domain,file,text
Q 9. What is the time of supply applicable with regard to addition in the value by way of interest, late fee or penalty or any delayed payment of consideration? Ans. The time of supply with regard to an addition in value on account of interest, late fee or penalty or delayed consideration shall be the date on which the supplier received such additional consideration. Q 10. Is there any change in time of supply, where supply is completed prior to or after change in rate of tax? Ans. Yes. In such cases provisions of Section 14 will apply. Q 11. What is the time of supply, where supply is completed prior to change in rate of tax? Ans. In such cases time of supply will be (i) where the invoice for the same has been issued and the payment is also received after the change in rate of tax, the time of supply shall be the date of receipt of payment or the date of issue of invoice, whichever is earlier; or (ii) where the invoice has been issued prior to change in rate of tax but the payment is received after the change in rate of tax, the time of supply shall be the date of issue of invoice; or
(iii) where the payment is received before the change in rate of tax, but the invoice for the same has been issued after the change in rate of tax, the time of supply shall be the date of receipt of payment; Q 12. What is the time of supply, where supply is completed after to change in rate of tax? Ans. In such cases time of supply will be (i) where the payment is received after the change in rate of tax but the invoice has been issued prior to the change in rate of tax, the time of supply shall be the date of receipt of payment; or (ii) where the invoice has been issued and the payment is received before the change in rate of tax, the time of supply shall be the date of receipt of payment or date of issue of invoice, whichever is earlier; or (iii) where the invoice has been issued after the change in rate of tax but the payment is received before the change in rate of tax, the time of supply shall be the date of issue of invoice Q 13. Let’s say there was increase in tax rate from 18% to 20% w.e.f.1.6.2017. What is the tax rate applicable when services provided and invoice issued before change in rate in April 2017, but payment received after change in rate in June2017? Ans. The old rate of 18% shall be applicable as services are provided prior to 1.6.2017. Q 14. Let’s say there was increase in tax rate from 18% to 20% w.e.f. 1.6.2017. What is the tax rate
applicable when goods are supplied and invoice issued after change in rate in June 2017, but full advance payment was already received in April 2017? Ans. The new rate of 20% shall be applicable as goods are supplied and invoice issued after 1.6.2017 Q 15. What is the time period within which invoice has to be issued for supply of Goods? Ans. As per Section 31 of CGST/SGST Act a registered taxable person shall issue a tax invoice showing description, quantity and value of goods, tax charged thereon and other prescribed particulars, before or at the time of (a) removal of goods for supply to the recipient, where supply involves movement of goods or (b) delivery of goods or making available thereof to the recipient in other cases. Q 16. What is the time period within which invoice has to be issued for supply of Services? Ans. As per Section 31 of CGST/SGST Act a registered taxable person shall, before or after the provision of service, but within a period prescribed in this behalf, issue a tax invoice showing description, value of goods, tax payable thereon and other prescribed particulars. Q 17. What is the time period within which invoice has to be issued in a case involving continuous supply of goods? Ans. In case of continuous supply of goods, where
successive statements of accounts or successive payments are involved, the invoice shall be issued before or at the time each such statement is issued or, as the case may be, each such payment is received. Q 18. What is the time period within which invoice has to be issued in a case involving continuous supply of services? Ans. In case of continuous supply of services, (a) where the due date of payment is ascertainable from the contract, the invoice shall be issued before or after the payment is liable to be made by the recipient but within a period prescribed in this behalf whether or not any payment has been received by the supplier of the service; (b) where the due date of payment is not ascertainable from the contract, the invoice shall be issued before or after each such time when the supplier of service receives the payment but within a period prescribed in this behalf; (c) where the payment is linked to the completion of an event, the invoice shall be issued before or after the time of completion of that event but within a period prescribed in this behalf. Q 19. What is the time period within which invoice has to be issued where the goods being sent or taken on approval for sale? Ans. The invoice in respect of goods sent or taken on approval for sale or return shall be issued before or at the time of supply or six months from the date of approval, whichever is earlier.
6. Valuation in GST Q 1. What is the value of taxable supply to be adopted for the levy of GST? Ans. The value of taxable supply of goods and services shall ordinarily be ‘the transaction value’ which is the price paid or payable, when the parties are not related and price is the sole consideration. Section 15 of the CGST/SGST Act further elaborates various inclusions and exclusions from the ambit of transaction value. For example, the transaction value shall not include refundable deposit, discount allowed subject to certain conditions before or at the time of supply. Q 2. What is transaction value? Ans. Transaction value refers to the price actually paid or payable for the supply of goods and or services where the supplier and the recipient are not related and price is the sole consideration for the supply. It includes any amount which the supplier is liable to pay but which has been incurred by the recipient of the supply. Q 3. Are there separate valuation provisions for CGST, SGST and IGST and for Goods and Services? Ans. No, section 15 is common for all three taxes and also common for goods and services. Q 4. Is contract price not sufficient to determine valuation of supply? Ans. Contract price is more specifically referred to as ‘transaction value’ and that is the basis for computing tax. However, when the price is influenced by factors like relationship of parties or where certain transactions are deemed to be supply, which do not have a price, the value has to be determined in accordance with the GST Valuation Rules.
Q 5. Is reference to GST Valuation Rules required in all cases? Ans. No. Reference to GST Valuation Rules is required only in cases where value cannot be determined under sub- section (1) of Section 15. Q 6. Can the transaction value declared under section 15(1) be accepted? Ans. Yes, it can be accepted after examining for inclusions in section 15(2). Furthermore, the transaction value can be accepted even where the supplier and recipient are related, provided the relationship has not influenced the price. Q 7. Whether post-supply discounts or incentives are to be included in the transaction value? Ans. Yes. where the post-supply discount is established as per the agreement which is known at or before the time of supply and where such discount specifically linked to the relevant invoice and the recipient has reversed input tax credit attributable to such discount, the discount is allowed as admissible deduction under Section 15 of the model GST law. Q 8. Whether pre-supply discounts allowed before or at the time of supply are includible in the transaction value? Ans. No, provided it is allowed in the course of normal trade practice and has been duly recorded in the invoice. Q 9. When are the provisions of the Valuation Rules applicable? Ans. Valuation Rules are applicable when (i) consideration either wholly or in part not in money terms; (ii) parties are related or supply by any specified category of supplier; and
(iii) transaction value declared is not reliable. Q 10. What are the inclusions specified in Section 15(2) which could be added to Transaction Value? Ans. The inclusions specified in Section15 (2) which could be added to transaction value are as follows: a) Any taxes, duties, cesses, fees and charges levied under any statute, other than the SGST/CGST Act and the Goods and Services Tax (Compensation to the States for Loss of Revenue) Act, 2016, if charged separately by the supplier to the recipient; b) Any amount that the supplier is liable to pay in relation to such supply but which has been incurred by the recipient of the supply and not included in the price actually paid or payable for the goods and/or services; c) Incidental expenses, such as commission and packing, charged by the supplier to the recipient of a supply, including any amount charged for anything done by the supplier in respect of the supply of goods and/or services at the time of, or before delivery of the goods or as the case may be supply of the services; d) Interest or late fee or penalty for delayed payment of any consideration for any supply; and e) Subsidies directly linked to the price excluding subsidies provided by the Central and State Government.
7. GST Payment of Tax Q 1. What are the Payments to be made in GST regime? Ans. In the GST regime, for any intra-state supply, taxes to be paid are the Central GST (CGST), going into the account of the Central Government) and the State/UT GST (SGST, going into the account of the concerned State Government). For any inter-state supply, tax to be paid is Integrated GST (IGST) which will have components of both CGST and SGST. In addition, certain categories of registered persons will be required to pay to the government account Tax Deducted at Source (TDS) and Tax Collected at Source (TCS). In addition, wherever applicable, Interest, Penalty, Fees and any other payment will also be required to be made. Q 2. Who is liable to pay GST? Ans. In general, the supplier of goods or services is liable to pay GST. However, in specified cases like imports and other notified supplies, the liability may be cast on the recipient under the reverse charge mechanism. Further, in some notified cases of intra-state supply of services, the liability to pay GST may be cast on e-commerce operators through which such services are supplied. Also Government Departments making payments to vendors above a specified limit [2.5 lakh under one contract as per S.51(1)(d)] are required to deduct tax (TDS) and E-commerce operators are required to collect tax (TCS) on the net value [i.e. aggregate value of taxable supplies of goods and/or services but excluding such value of services on which the operator is made liable to pay GST under Section 9(5) of the CGST Act, 2017] of supplies made through them and deposit it with the Government.
Q 3. When does liability to pay GST arises? Ans. Liability to pay arises at the time of supply of Goods as explained in Section 12 and at the time of supply of services as explained in Section13. The time is generally the earliest of one of the three events, namely receiving payment, issuance of invoice or completion of supply. Different situations envisaged and different tax points have been explained in the aforesaid sections. Q 4. What are the main features of GST payment process? Ans. The payment processes under GST Act(s) have the following features: • Electronically generated challan from GSTN Common Portal in all modes of payment and no use of manually prepared challan; • Facilitation for the tax payer by providing hassle free, anytime, anywhere mode of payment of tax; • Convenience of making payment online; • Logical tax collection data in electronic format; • Faster remittance of tax revenue to the Government Account; • Paperless transactions; • Speedy Accounting and reporting; • Electronic reconciliation of all receipts; • Simplified procedure for banks • Warehousing of Digital Challan.
Q 5. How can payment be done? Ans. Payment can be done by the following methods: (i) Through debit of Credit Ledger of the tax payer maintained on the Common Portal – ONLY Tax can be paid. Interest, Penalty and Fees cannot be paid by debit in the credit ledger. Tax payers shall be allowed to take credit of taxes paid on inputs (input tax credit) and utilize the same for payment of output tax. However, no input tax credit on account of CGST shall be utilized towards payment of SGST and vice versa. The credit of IGST would be permitted to be utilized for payment of IGST, CGST and SGST in that order. (ii) In cash by debit in the Cash Ledger of the tax payer maintained on the Common Portal. Money can be deposited in the Cash Ledger by different modes, namely, E-Payment (Internet Banking, Credit Card, Debit Card); Real Time Gross Settlement (RTGS)/ National Electronic Fund Transfer (NEFT); Over the Counter Payment in branches of Banks Authorized to accept deposit of GST. Q 6. When is payment of taxes to be made by the Supplier? Ans. Payment of taxes by the normal tax payer is to be done on monthly basis by the 20th of the succeeding month. Cash payments will be first deposited in the Cash Ledger and the tax payer shall debit the ledger while making payment in the monthly returns and shall reflect the relevant debit entry number in his return. As mentioned earlier, payment can also be debited from the Credit Ledger. Payment of taxes for the month of March shall be paid by the 20th of April. Composition tax payers will need to pay tax on
quarterly basis. Q 7. Whether time limit for payment of tax can be extended or paid in monthly installments? Ans. No, this is not permitted in case of self-assessed liability. In other cases, competent authority has been empowered to extend the time period or allow payment in instalments. (Section 80 of the CGST/SGST Act). Q 8. What happens if the taxable person files the return but does not make payment of tax? Ans. In such cases, the return is not considered as a valid return. Section 2(117) defines a valid return to mean a return furnished under sub-section (1) of section 39 on which self-assessed tax has been paid in full. It is only the valid return that would be used for allowing input tax credit (ITC) to the recipient. In other words, unless the supplier has paid the entire self-assessed tax and filed his return and the recipient has filed his return, the ITC of the recipient would not be confirmed. Q 9. Which date is considered as date of deposit of the tax dues – Date of presentation of cheque or Date of payment or Date of credit of amount in the account of government? Ans. It is the date of credit to the Government account.
Q 10. What are E-Ledgers? Ans. Electronic Ledgers or E-Ledgers are statements of cash and input tax credit in respect of each registered taxpayer. In addition, each taxpayer shall also have an electronic tax liability register. Once a taxpayer is registered on Common Portal (GSTN), two e-ledgers (Cash &Input Tax Credit ledger) and an electronic tax liability register will be automatically opened and displayed on his dash board at all times. Q 11. What is a tax liability register? Ans. Tax Liability Register will reflect the total tax liability of a taxpayer (after netting) for the particular month. Q 12. What is a Cash Ledger? Ans. The cash ledger will reflect all deposits made in cash, and TDS/TCS made on account of the taxpayer. The information will be reflected on real time basis. This ledger can be used for making any payment on account of GST. Q 13. What is an ITC Ledger? Ans. Input Tax Credit as self-assessed in monthly returns will be reflected in the ITC Ledger. The credit in this ledger can be used to make payment of TAX ONLY and not other amounts such as interest, penalty, fees etc. Q 14. What is the linkage between GSTN and the authorized Banks?
Ans. There will be real time two-way linkage between the GSTN and the Core Banking Solution (CBS) of the Bank. CPIN is automatically routed to the Bank via electronic string for verification and receiving payment and a challan identification number (CIN) is automatically sent by the Bank to the Common Portal confirming payment receipt. No manual intervention will be involved in the process by any one including bank cashier or teller or the tax payer. Q 15. Can a tax payer generate challan in multiple sittings? Ans. Yes, a taxpayer can partially fill in the challan form and temporarily “save” the challan for completion at a later stage. A saved challan can be “edited” before finalization. After the tax payer has finalized the challan, he will generate the challan, for use of payment of taxes. The remitter will have option of printing the challan for his record. Q 16. Can a challan generated online be modified? Ans. No. After logging into GSTN portal for generation of challan, payment particulars have to be fed in by the tax payer or his authorized person. He can save the challan midway for future updation. However once the challan is finalized and CPIN generated, no further changes can be made to it by the taxpayer.
Q 17. Is there a validity period of challan? Ans. Yes, a challan will be valid for fifteen days after its generation and thereafter it will be purged from the System. However, the tax payer can generate another challan at his convenience. Q 18. What is a CPIN? Ans. CPIN stands for Common Portal Identification Number (CPIN) given at the time of generation of challan. It is a 14-digit unique number to identify the challan. As stated above, the CPIN remains valid for a period of 15 days. Q 19. What is a CIN and what is its relevance? Ans. CIN stands for Challan Identification Number. It is a 17-digit number that is 14-digit CPIN plus 3-digit Bank Code. CIN is generated by the authorized banks/ Reserve Bank of India (RBI) when payment is actually received by such authorized banks or RBI and credited in the relevant government account held with them. It is an indication that the payment has been realized and credited to the appropriate government account. CIN is communicated by the authorized bank to taxpayer as well as to GSTN. Q 20. What is the sequence of payment of tax where that taxpayer has liabilities for previous months also? Ans. Section 49(8) prescribes an order of payment where the taxpayer has tax liability beyond the current return period. In such a situation, the order of payment to be followed is: First self-assessed tax and other dues for the previous period; thereafter self-assessed tax and other
dues for the current period; and thereafter any other amounts payable including any confirmed demands under section 73 or 74. This sequence has to be mandatorily followed. Q 21. What does the expression “Other dues” referred to above mean? Ans. The expression “other dues” means interest, penalty, fee or any other amount payable under the Act or the rules made thereunder. Q 22. What is an E-FPB? Ans. E-FPB stands for Electronic Focal Point Branch. These are branches of authorized banks which are authorized to collect payment of GST. Each authorized bank will nominate only one branch as its E-FPB for pan India Transactions. The E-FPB will have to open accounts under each major head for all governments. Total 38 accounts (one each for CGST, IGST and one each for SGST for each State/UT Govt.) will have to be opened. Any amount received by such E-FPB towards GST will be credited to the appropriate account held by such E- FPB. For NEFT/RTGS Transactions, RBI will act as E-FPB. Q 23. What is TDS? Ans. TDS stands for Tax Deducted at Source (TDS). As per section 51, this provision is meant for Government and Government undertakings and other notified entities making contractual payments where total value of such supply under a contract exceeds Rs. 2.5 Lakhs to suppliers. While making any
payments under such contracts, the concerned Government/authority shall deduct 1% of the total payment made and remit it into the appropriate GST account. Q 24. How will the Supplier account for this TDS? while filing his return? Ans. Any amount shown as TDS will be reflected in the electronic cash ledger of the concerned supplier. He can utilize this amount towards discharging his liability towards tax, interest fees and any other amount. Q 25. How will the TDS Deductor account for such TDS? Ans. TDS Deductor will account for such TDS in the following ways: 1. Such deductors needs to get compulsorily registered under section 24 of the CGST/SGST Act. 2. They need to remit such TDS collected by the 10th day of the month succeeding the month in which TDS was collected and reported in GSTR 7. 3. The amount deposited as TDS will be reflected in the electronic cash ledger of the supplier. 4. They need to issue certificate of such TDS to the deductee within 5 days of crediting the TDS to the govt a/c, failing which fees of Rs. 100 per day subject to maximum of Rs. 5000/- will be payable by such deductor. Q 26. What is Tax Collected at Source (TCS)? Ans. This provision is applicable only for E-Commerce Operator under section 52 of CGST/SGST Act. Every E-
Commerce Operator, not being an agent, needs to withhold an amount calculated at the rate not exceeding one percent of the “net value of taxable supplies” made through it where the consideration with respect to such supplies is to be collected by the operator. Such withheld amount is to be deposited by such E-Commerce Operator to the appropriate GST account by the 10th of the next month. The amount deposited as TCS will be reflected in the electronic cash ledger of the supplier. Q 27. What does the expression “Net value of taxable supplies” mean? Ans. The expression “net value of taxable supplies” means the aggregate value of taxable supplies of goods or services, other than services notified under Section 9(5), made during any month by all registered taxable persons through the operator reduced by the aggregate value of taxable supplies returned to the suppliers during the said month. Q 28. Is the pre-registration of credit card necessary in the GSTN portal for the GST payment? Ans. Yes. The taxpayer would be required to pre-register his credit card, from which the tax payment is intended, with the Common Portal maintained on GSTN. GSTN may also attempt to put in a system with banks in getting the credit card verified by taking a confirmation from the credit card service provider. The payments using credit cards can therefore be allowed without any monetary limit to facilitate ease of doing business. ****
8. Electronic Commerce Q 1. What is Electronic Commerce? Ans. Electronic Commerce has been defined to mean the supply of goods or services or both, including digital products over digital or electronic network. Q 2. Who is an e-commerce operator? Ans. Electronic Commerce Operator has been defined to mean any person who owns, operates or manages digital or electronic facility or platform for electronic commerce. Q 3. Is it mandatory for e-commerce operator to obtain registration? Ans. Yes. The benefit of threshold exemption is not available to e-commerce operators and they would be liable to be registered irrespective of the value of supply made by them. Q 4. Whether a supplier of goods or services supplying through e-commerce operator would be entitled to threshold exemption? Ans. No. The threshold exemption is not available to such suppliers and they would be liable to be registered irrespective of the value of supply made by them. This requirement, however, is applicable only if the supply is made through such electronic commerce operator who is required to collect tax at source. Q 5. Will an e-commerce operator be liable to pay tax in respect of supply of goods or services made through it, instead of actual supplier?
Ans. Yes, but only in case of certain notified services. In such cases tax shall be paid by the electronic commerce operator if such services are supplied through it and all the provisions of the Act shall apply to such electronic commerce operator as if he is the person liable to pay tax in relation to supply of such services. Q 6. Will threshold exemption be available to electronic commerce operators liable to pay tax on notified services? Ans. No. Threshold exemption is not available to e- commerce operator who are require to pay tax on notified services provided through them. Q 7. What is Tax Collection at Source (TCS)? Ans. The e-commerce operator is required to collect an amount calculated at the rate not exceeding one percent of the net value of taxable supplies made through it, where the consideration with respect to such supplies is to be collected by such operator. The amount so collected is called as Tax Collection at Source (TCS). Q 8. It is very common that customers of e- commerce companies return goods. How these returns are going to be adjusted? Ans. An e-commerce company is required to collect tax only on the net value of taxable supplies. In other words, value of the supplies which are returned are adjusted in the aggregate value of taxable supplies.
