domain,file,text
chartered accountant or a cost accountant. (Section 35(5) of the CGST/SGST Act) (b) Audit by Department: The Commissioner or any officer of CGST or SGST or UTGST authorized by him by a general or specific order, may conduct audit of any registered person. The frequency and manner of audit will be prescribed in due course. (Section 65 of the CGST/SGST Act) (c) Special Audit: If at any stage of scrutiny, inquiry, investigations or any other proceedings, if department is of the opinion that the value has not been correctly declared or credit availed is not with in the normal limits, department may order special audit by chartered accountant or cost accountant, nominated by department. (Section 66 of the CGST/SGST Act) Q 14. Whether any prior intimation is required before conducting the audit? Ans. Yes, prior intimation is required and the taxable person should be informed at least 15 working days prior to conduct of audit. Q 15. What is the period within which the audit is to be completed? Ans. The audit is required to be completed within 3 months from the date of commencement of audit. The period is extendable for a further period of a maximum of 6 months by the Commissioner. Q 16. What is meant by commencement of audit? Ans. The term ‘commencement of audit’ is important because audit has to be completed within a given time frame in reference to this date of commencement. Commencement of audit means the later of the following: a) the date on which the records/accounts called
for by the audit authorities are made available to them, or b) the actual institution of audit at the place of business of the taxpayer. Q 17. What are the obligations of the taxable person when he receives the notice of audit? Ans. The taxable person is required to: a) facilitate the verification of accounts/records available or requisitioned by the authorities, b) provide such information as the authorities may require for the conduct of the audit, and c) render assistance for timely completion of the audit. Q 18. What would be the action by the proper officer upon conclusion of the audit? Ans. The proper officer shall, on conclusion of audit, within 30 days inform the taxable person about his findings, reasons for findings and the taxable person’s rights and obligations in respect of such findings. Q 19. Under what circumstances can a special audit be instituted? Ans. A special audit can be instituted in limited circumstances where during scrutiny, investigation, etc. it comes to the notice that a case is complex or the revenue stake is high. This power is given in section 66 of CGST /SGST Act. Q 20. Who can serve the notice of communication for special audit? Ans. The Assistant / Deputy Commissioner is to serve the communication for special audit only after prior
approval of the Commissioner. Q 21. Who will do the special audit? Ans. A Chartered Accountant or a Cost Accountant so nominated by the Commissioner may undertake the audit. Q 22. What is the time limit to submit the audit report? Ans. The auditor will have to submit the report within 90 days or within the further extended period of 90 days. Q 23. Who will bear the cost of special audit? Ans. The expenses for examination and audit including the remuneration payable to the auditor will be determined and borne by the Commissioner. Q 24. What action the tax authorities may take after the special audit? Ans. Based on the findings / observations of the special audit, action can be initiated under Section 73 or Section 74 of the CGST/SGST Act. ****
14. Refunds Q 1. What is refund? Ans. Refund has been discussed in section 54 of the CGST/SGST Act. “Refund” includes (a) any balance amount in the electronic cash ledger so claimed in the returns, (b) any unutilized input tax credit in respect of (i) zero rated supplies made without payment of tax or, (ii) where the credit has accumulated on account of rate of tax on inputs being higher than the rate of tax on output supplies (other than nil rated or fully exempt supplies), (c) tax paid by specialized agency of United Nations or any Multilateral Financial Institution and Organization notified under the United Nations (Privileges and Immunities) Act, 1947, Consulate or Embassy of foreign countries on any inward supply Q 2. Can unutilized Input tax credit be allowed as refund? Ans. Unutilized input tax credit can be allowed as refund in accordance with the provisions of sub-section (3) of section 54 in the following situations: - (i) Zero rated supplies made without payment of tax; (ii) Where credit has accumulated on account of rate of tax on inputs being higher than the rate of taxes on output supplies (other than nil rated or fully exempt supplies)
However, no refund of unutilized input tax credit shall be allowed in cases where the goods exported out of India are subjected to export duty, and also in the case where the supplier of goods or services or both avails of drawback in respect of central tax or claims refund of the integrated tax paid on such supplies. Q 3. Can unutilized ITC be given refund, in case goods Exported outside India are subjected to export duty? Ans. Refund of unutilized input tax credit is not allowed in cases where the goods exported out of India are subjected to export duty - as per the second proviso to Section 54(3) of CGST/SGST Act. Q 4. Will unutilized ITC at the end of the financial year (after introduction of GST) be refunded? Ans. There is no such provision to allow refund of such unutilized ITC at the end of the financial year in the GST Law. It shall be carried forward to the next financial year. Q 5. Suppose a taxable person has paid IGST/ CGST/SGST mistakenly as an Interstate/intrastate supply, but the nature of which is subsequently clarified. Can the CGST/SGST be adjusted against wrongly paid IGST or vice versa?
Ans. The taxable person cannot adjust CGST/SGST or IGST with the wrongly paid IGST or CGST/SGST but he is entitled to refund of the tax so paid wrongly - Sec.77 of the CGST/SGST Act. Q 6. Whether purchases made by Embassies or UN are taxed or exempted? Ans. Supplies to the Embassies or UN bodies will be taxed, which later on can be claimed as refund by them in terms of Section 54(2) of the CGST/SGST Act. The claim has to be filed in the manner prescribed under CGST/SGST Refund rules, before expiry of six months from the last day of the month in which such supply was received. [The United Nations Organization and Consulates or Embassies are required to take a Unique Identity Number [section 26(1) of the CGST/SGST Act] and purchases made by them will be reflected against their Unique Identity Number in the return of outward supplies of the supplier(s)] Q 7. What is the time limit for taking refund?
Ans. A person claiming refund is required to file an application before the expiry of two years from the “relevant date” as given in the Explanation to section 54 of the CGST/SGST Act. Q 8. Whether principle of unjust enrichment will be applicable in refund? Ans. The principle of unjust enrichment would be applicable in all cases of refund except in the following cases: - i. Refund of tax paid on zero-rated supplies of goods or services or both or on inputs or input services used in making such zero-rated supplies ii. Unutilized input tax credit in respect of (i) zero rated supplies made without payment of tax or, (ii) where the credit has accumulated on account of rate of tax on inputs being higher than the rate of tax on output supplies iii. refund of tax paid on a supply which is not provided, either wholly or partially, and for which invoice has not been issued; iv. refund of tax in pursuance of Section 77 of CGST/SGST Act i.e. tax wrongfully collected and paid to Central Government or State Government v. if the incidence of tax or interest paid has not been passed on to any other person; vi. such other class of persons who has borne the incidence of tax as the Government may notify. Q 9. In case the tax has been passed on to the
consumer, whether refund will be sanctioned? Ans. Yes, the amount so refunded shall be credited to the Consumer Welfare Fund - Section 57 of the CGST/SGST Act Q 10. Is there any time limit for sanctioning of refund? Ans. Yes, refund has to be sanctioned within 60 days from the date of receipt of application complete in all respects. If refund is not sanctioned within the said period of 60 days, interest at the rate notified will have to be paid in accordance with section 56 of the CGST/SGST Act. However, in case where provisional refund to the extent of 90% of the amount claimed is refundable in respect of zero-rated supplies made by certain categories of registered persons in terms of sub-section (6) of section 54 of the CGST/SGST Act, the provisional refund has to be given within 7 days from the date of acknowledgement of the claim of refund. Q 11. Can refund be withheld by the department? Ans. Yes, refund can be withheld in the following circumstances: i. If the person has failed to furnish any return till he files such return; ii. If the registered taxable person is required to pay any tax, interest or penalty which has not been stayed by the appellate authority/Tribunal/ court, till he pays such tax interest or penalty;
The proper officer can also deduct unpaid taxes, interest, penalty, late fee, if any, from the refundable amount – Section 54(10) (d) of the CGST/SGST Act iii. The Commissioner can withhold any refund, if, the order of refund is under appeal and he is of the opinion that grant of such refund will adversely affect revenue in the said appeal on account of malfeasance or fraud committed - Sec.54 (11) of the CGST/SGST Act. Q 12. Where the refund is withheld under Section 54(11) of the CGST/SGST Act, will the taxable person be given interest? Ans. If as a result of appeal or further proceeding the taxable person becomes entitled to refund, then he shall also be entitled to interest at the rate notified [section 54(12) of the CGST/SGST Act]. Q 13. Is there any minimum threshold for refund? Ans. No refund shall be granted if the amount is less than Rs.1000/-. [Sec.54 (14) of the CGST/SGST Act] Q 14. How will the refunds arising out of existing law be paid? Ans. The refund arising out of existing law will be paid as per the provisions of the existing law and will be made in
cash and will not be available as ITC. Q 15. Whether refund can be made before verification of documents? Ans. In case of any claim of refund to a registered person on account of zero rated supplies of goods or services or both (other than registered persons as may be notified), 90% refund may be granted on provisional basis before verification subject to such conditions and restrictions as may be prescribed in accordance with sub-section 6 of section 54 of the CGST/SGST Act. Q 16. In case of refund under exports, whether BRC is necessary for granting refund? Ans. In case of refund on account of export of goods, the refund rules do not prescribe BRC as a necessary document for filing of refund claim. However, for export of services details of BRC is required to be submitted along with the application for refund. Q 17. Will the principle of unjust enrichment apply to exports and supplies to SEZ Units? Ans. The principle of unjust enrichment would not be applicable to zero-rated supplies [i.e. exports and supplies to SEZ units] Q 18. How will the applicant prove that the principle of unjust enrichment does not apply in his case?
Ans. Where the claim of refund is less than Rs.2 Lakh, a self- declaration by the applicant based on the documentary or other evidences available with him, certifying that the incidence of tax has not been passed on to any other person would make him eligible to get refund. However, if the claim of refund is more than Rs.2 Lakh, the applicant is required to submit a certificate from a Chartered Accountant or a Cost Accountant to the effect that the incidence of tax has not been passed on to any other person. Q 19. Today under VAT/CST merchant exporters can purchase goods without payment of tax on furnishing of a declaration form. Will this system be there in GST? Ans. There is no such provision in the GST law. They will have to procure goods upon payment of tax and claim refund of the tax paid or the unutilized input tax credit in accordance with section 54(1)/54(3) of the CGST/SGST Act. Q 20. Presently under Central law, exporters are allowed to obtain duty paid inputs, avail ITC on it and export goods upon payment of duty (after utilizing the ITC) and thereafter claim refund of the duty paid on exports. Will this system continue in GST? Ans. Yes. In terms of Section 16 of the IGST Act, a
registered taxable person shall have the option either to export goods/services without payment of IGST under bond or letter of undertaking and claim refund of ITC or he can export goods/services on payment of IGST and claim refund of IGST paid. Q 21. What is the time period within which an acknowledgement of a refund claim has to be given? Ans. Where an application relates to a claim for refund from the electronic cash ledger as per sub-section (6) of section 49 of the CGST/SGST Act made through the return furnished for the relevant tax period the acknowledgement will be communicated as soon as the return is furnished and in all other cases of claim of refund the acknowledgement will be communicated to the applicant within 15 days from the date of receipt of application complete in all respect. Q 22. What is the time period within which provisional refund has to be given? Ans. Provisional refund to the extent of 90% of the amount claimed on account of zero-rated supplies in terms of sub-section (6) of section 54 of the CGST/SGST Act has to be given within 7 days from the date of acknowledgement of complete application for refund claim. Q 23. Is there any specified format for filing refund
claim? Ans. Every claim of refund has to be filed in Form GST RFD 1. However, claim of refund of balance in electronic cash ledger can be claimed through furnishing of monthly/quarterly returns in Form GSTR 3, GSTR 4 or GSTR 7, as the case may be, of the relevant period. Q 24. Is there any specified format for sanction of refund claim? Ans. The claim of refund will be sanctioned by the proper officer in Form GST RFD-06 if the claim is found to be in order and payment advice will be issued in Form GST RFD- 05. The refund amount will then be electronically credited to the applicants given bank account. Q 25. What happens if there are deficiencies in the refund claim? Ans. Deficiencies, if any, in the refund claim has to be pointed out within 15 days. A form GST RFD-03 will be issued by the proper officer to the applicant pointing out the deficiencies through the common portal electronically requiring him to file a refund application after rectification of such deficiencies. Q 26. Can the refund claim be rejected without assigning any reasons?
Ans. No. When the proper officer is satisfied that the claim is not admissible he shall issue a notice in Form GST RFD-08 to the applicant requiring him to furnish a reply in GST RFD -09 within fifteen days and after consideration of the applicant’s reply, he can accept or reject the refund claim and pass an order in Form GST RFD-06 only. ****
15. Demands and Recovery Q 1. Which are the applicable sections for the purpose of recovery of tax short paid or not paid or amount erroneously refunded or input tax credit wrongly availed or utilized? Ans. Section 73 deals with the cases where there is no invocation of fraud/suppression/mis-statement etc. Section 74 deals with cases where the provisions related to fraud/suppression/mis-statement etc. are invoked. Q 2. What if person chargeable with tax, pays the amount along with interest before issue of show cause notice under section 73? Ans. In such cases notice shall not be issued by the proper officer. {sec.73 (6)} Q 3. If show cause notice is issued under Section 73 and thereafter the noticee makes payment along with applicable interest, is there any need to adjudicate the case? Ans. If the person pays the tax along with interest within 30 days of issue of notice, no penalty shall be payable and all proceedings in respect of such notice shall be deemed to be concluded. {sec.73 (8)} Q 4. What is the relevant date for issue of Show Cause Notice? Ans. (i) In case of section 73(cases other than fraud/ suppression of facts/willful misstatement), the relevant date shall be counted from the due date for filing of annual return for the financial year to which demand relates to.
The SCN has to be adjudicated within at period of three years from the due date of filing of annual return. The SCN is required to be issued at least three months prior to the time limit set for adjudication. {sec.73(2&10)} (ii) In case of section 74(cases involving fraud/ suppression of facts/willful misstatement), the relevant date shall be counted from the due date for filing of annual return for the financial year to which demand relates to. The SCN has to be adjudicated within at period of five years from the due date of filing of annual return. The SCN is required to be issued at least six months prior to the time limit set for adjudication. {sec.74(2&10)} Q 5. Is there any time limit for adjudication the cases? Ans: (i) In case of section 73(cases other than fraud/ suppression of facts/willful misstatement), the time limit for adjudication of cases is 3 years from the due date for filing of annual return for the financial year to which demand relates to or the date of erroneous refund/ITC wrongly availed. {sec.73(10)} (ii) In case of section 74(cases of fraud/suppression of facts/willful misstatement), the time limit for adjudication is 5 years from the due date for filing of annual return for the financial year to which demand relates to or the date of erroneous refund/ITC wrongly availed. {sec.74(10)}
Q 6. Is there any immunity to a person chargeable with tax in cases of fraud/suppression of facts/ willful misstatement, who pays the amount of demand along-with interest before issue of notice? Ans. Yes. Person chargeable with tax, shall have an option to pay the amount of tax along with interest and penalty equal to 15% percent of the tax involved, as ascertained either on his own or ascertained by the proper officer, and on such payment, no notice shall be issued with respect to the tax so paid. {sec. 74(6)} Q 7. If notice is issued under Section 74 and thereafter the noticee makes payment, is there any need to adjudicate the case? Ans. Where the person to whom a notice has been issued under sub-section (1) of section 74, pays the tax along with interest with penalty equal to 25% of such tax within 30 days of issue of notice, all proceedings in respect of such notice shall be deemed to be concluded. {sec.74 (8)} Q 8. In case a notice is adjudicated under Section 74 and order issued confirming tax demand and penalty, does the noticee have any option to pay reduced penalty? Ans. Yes. if any person pays the tax determined by the order along with interest and a penalty equivalent to 50% of such tax within thirty days of the communication of order, all proceedings in respect of the said tax shall be deemed to be concluded. {sec.74 (11)} Q 9. What will happen in cases where notice is issued but order has not been passed under section 73 & 74 within time specified for adjudication under these sections? Ans. Section 75 (10) provides for deemed conclusion of the
adjudication proceedings if the order is not issued within time limit prescribed under these sections. Q 10. What happens if a person collects tax from another person but does not deposit the same with Government? Ans. It is mandatory to pay amount, collected from other person representing tax under this act, to the government. For any such amount not so paid, proper officer may issue SCN for recovery of such amount and penalty equivalent to such amount. {Sec.76 (1&2)} Q 11. In case the person does not deposit tax collected in contravention of Section 76(1), what is the proper course of action to be taken? Ans. SCN may be issued and if so, an order shall be passed following Principles of natural justice within one year of date of issue of such notice. {sec.76 (2 to 6)} Q 12. What is the time limit to issue notice in cases under Section 76 i.e. taxes collected but not paid to Government? Ans. There is no time limit. Notice can be issued on detection of such cases without any time limit. Q 13. What are the modes of recovery of tax available to the proper officer? Ans. The proper officer may recover the dues in following manner:
a) Deduction of dues from the amount owned by the tax authorities payable to such person. b) Recovery by way of detaining and selling any goods belonging to such person; c) Recovery from other person, from whom money is due or may become due to such person or who holds or may subsequently hold money for or on account of such person, to pay to the credit of the Central or a State Government; d) Distrain any movable or immovable property belonging to such person, until the amount payable is paid. If the dues not paid within 30days, the said property is to be sold and with the proceeds of such sale the amount payable and cost of sale shall be recovered. e) Through the Collector of the district in which such person owns any property or resides or carries on his business, as if it was an arrear of land revenue. (f) By way of an application to the appropriate Magistrate who in turn shall proceed to recover the amount as if it were a fine imposed by him. (g) Through enforcing the bond /instrument executed under this Act or any rules or regulations made thereunder. (h) CGST arrears can be recovered as an arrear of SGST and vice-versa. {sec.79 (1,2,3,4)} Q 14. Whether the payment of tax dues can be made in installments? Ans. On receipt of any such request, Commissioner/Chief Commissioner may extend the time for payment or allow payment of any amount due under the Act, other than the amount due as per the liability self-assessed in any return, by such person in monthly installments not exceeding
twenty four, subject to payment of interest under section 50 with such limitations and conditions as may be prescribed. However, where there is default in payment of any one installment on its due date, the whole outstanding balance payable on such date shall become payable and recovered without any further notice. {sec.80} Q 15. What is the course of recovery in cases where the tax demand confirmed is enhanced in appeal/ revision proceedings? Ans. The notice of demand is required to be served only in respect of the enhanced dues. In so far as the amount already confirmed prior to disposal of appeal/revision, the recovery proceedings may be continued from the stage at which such proceedings stood immediately before such disposal of appeal/revision. (Sec.84(a)) Q 16. If a taxable person with pending tax dues, transfers his business to another person, what would happen to the tax dues? Ans. The person, to whom the business is transferred, shall jointly and severally be liable to pay the tax, interest or penalty due from the taxable person up to the time of such transfer, whether such dues has been determined before such transfer, but has remained unpaid or is determined thereafter. {Sec. 85(1)} Q 17. What happens to tax dues where the Company (taxable person) goes into liquidation? Ans. When any company is wound up, every appointed receiver of assets (“Liquidator”) shall give intimation of his appointment to Commissioner within 30 days. On receipt of such intimation Commissioner may notify amount sufficient to recover tax liabilities/dues to the liquidator within 3
months. {Sec. 88(1,2)} Q 18. What is the liability of directors of the Company (taxable person) under liquidation? Ans: When any private company is wound up and any tax or other dues determined whether before or after liquidation that remains unrecovered, every person who was a director of the company during the period for which the tax was due, shall jointly and severally be liable for payment of dues unless he proves to the satisfaction of the Commissioner that such non-recovery is not attributed to any gross neglect, misfeasance or breach of duties on his part in relation to the affairs of the company. {Sec.88(3),89} Q 19. What is the liability of partners of a partnership firm (Taxable person) to pay outstanding tax? Ans. Partners of any firm shall jointly and severally be liable for payment of any tax, interest or penalty. Firm/ partner shall intimate the retirement of any partner to the Commissioner by a notice in writing. Liability to pay tax, interest or penalty up to the date of such retirement, whether determined on that date or subsequently, shall be on such partner. If no intimation is given within one month from the date of retirement, the liability of such partner shall continue until the date on which such intimation is received by the Commissioner. {Sec.90} Q 20. What happens to the tax liability of a taxable person, whose business is carried on by any guardian/ trustee or agent of a minor?
